{"record_id":"gr.approval.example.001","record_type":"approval","schema_version":"1.0.0","subject":{"type":"action","id":"action.example.001"},"actor":{"type":"human","id":"human.example"},"authority":{"basis":"human_authorization","authority_id":"authority.example.001","status":"active"},"approval":{"required":true,"status":"approved","approver":{"type":"human","id":"human.example"},"scope":"Approve execution of action.example.001","timestamp":"2026-09-16T15:00:00Z"},"timestamps":{"created_at":"2026-09-16T15:00:00Z","occurred_at":"2026-09-16T15:00:00Z","authorized_at":"2026-09-16T15:00:00Z"}}