{"record_id":"gr.handoff.example.001","record_type":"handoff","schema_version":"1.0.0","subject":{"type":"task","id":"task.example.001"},"actor":{"type":"orchestrator","id":"orchestrator.a"},"authority":{"basis":"delegation","authority_id":"authority.orchestration.001","status":"active"},"handoff":{"from":{"type":"orchestrator","id":"orchestrator.a"},"to":{"type":"orchestrator","id":"orchestrator.b"},"status":"accepted","scope":{"task":{"type":"task","id":"task.example.001"},"description":"Continue implementation and validation.","completed":["Requirements reconciled"],"remaining":["Implementation","Validation"],"blocked":[]},"authority_transfer":{"transferred":true,"authority_ref":{"type":"authority","id":"authority.orchestration.001"},"scope":["implementation","validation"],"delegated_by":{"type":"human","id":"human.example"}},"trust_boundary":{"crossed":true,"boundary_type":"orchestrator","boundary_ref":{"type":"orchestrator","id":"orchestrator.b"},"additional_controls_required":["handoff acceptance","authority verification"]},"acceptance":{"accepted_by":{"type":"orchestrator","id":"orchestrator.b"},"accepted_at":"2026-09-16T15:20:00Z"}},"timestamps":{"created_at":"2026-09-16T15:20:00Z","occurred_at":"2026-09-16T15:20:00Z"}}