{"record_id":"gr.unauthorized.example.001","record_type":"action","schema_version":"1.0.0","subject":{"type":"task","id":"task.example.002"},"actor":{"type":"agent","id":"agent.example"},"authority":{"basis":"delegation","authority_id":"authority.example.002","status":"pending"},"approval":{"required":true,"status":"pending","approver":{"type":"human","id":"human.example"},"scope":"Execute task.example.002","timestamp":"2026-09-16T16:05:00Z"},"action":{"type":"execute","status":"completed"},"timestamps":{"created_at":"2026-09-16T16:05:00Z","occurred_at":"2026-09-16T16:05:01Z","completed_at":"2026-09-16T16:05:05Z"}}