{"record_id":"gr.conformance.example.001","record_type":"conformance","schema_version":"1.0.0","subject":{"type":"governance_record","id":"gr.action.example.001"},"actor":{"type":"validator","id":"governance-commons-validator"},"conformance":{"report":{"type":"conformance_report","id":"report.example.001"},"result":"conformant","specification":{"type":"specification","id":"governance-record"},"specification_version":"1.0.0","profile":"standard"},"timestamps":{"created_at":"2026-09-16T15:30:00Z","occurred_at":"2026-09-16T15:30:00Z"}}