{"record_id":"gr.dispatch.001","record_type":"dispatch","schema_version":"1.0.0","actor":{"type":"orchestrator","id":"orchestrator.a"},"dispatch":{"target":{"type":"agent","id":"agent.example"},"scope":"validation"},"timestamps":{"created_at":"2026-09-16T15:10:00Z","occurred_at":"2026-09-16T15:10:00Z"}}