{"record_id":"gr.provenance.001","record_type":"provenance","schema_version":"1.0.0","actor":{"type":"agent","id":"agent.example"},"provenance":{"source":{"type":"artifact","id":"artifact.example"},"method":"generated-from-record"},"timestamps":{"created_at":"2026-09-16T15:33:00Z","occurred_at":"2026-09-16T15:33:00Z"}}