{"record_id":"gr.incomplete-handoff.example.001","record_type":"handoff","schema_version":"1.0.0","subject":{"type":"task","id":"task.example.004"},"actor":{"type":"orchestrator","id":"orchestrator.a"},"authority":{"basis":"delegation","authority_id":"authority.orchestration.004","status":"active"},"handoff":{"from":{"type":"orchestrator","id":"orchestrator.a"},"to":{"type":"orchestrator","id":"orchestrator.b"},"status":"accepted","scope":{"description":"Continue work."},"authority_transfer":{"transferred":false,"authority_ref":{"type":"authority","id":"authority.orchestration.004"},"scope":[],"delegated_by":{"type":"human","id":"human.example"}},"trust_boundary":{"crossed":true,"boundary_type":"orchestrator","boundary_ref":{"type":"orchestrator","id":"orchestrator.b"}},"acceptance":{"accepted_by":{"type":"orchestrator","id":"orchestrator.b"},"accepted_at":"2026-09-16T16:20:00Z"}},"timestamps":{"created_at":"2026-09-16T16:20:00Z","occurred_at":"2026-09-16T16:20:00Z"}}