{"record_id":"gr.eco.example.001","record_type":"intent","schema_version":"1.0.0","actor":{"type":"human","id":"human.example"},"intent":{"statement":"Determine whether the proposed work should proceed.","objective":"Evaluate the proposed task before initiation."},"framework_context":{"eco":{"version":"1.x","a4":{"stage":"ALIGN"},"e4":{"disposition":"DO"},"i4":{"stage":"INTEND","statement":"Proceed with evaluation."},"p4":{"context":{"type":"PROJECT","id":"project.example"}},"future_eco_extension":{"example":true}}},"timestamps":{"created_at":"2026-09-16T15:10:00Z","occurred_at":"2026-09-16T15:10:00Z"}}