{"record_id":"gr.action.example.001","record_type":"action","schema_version":"1.0.0","subject":{"type":"task","id":"task.example.001"},"actor":{"type":"agent","id":"agent.example"},"authority":{"basis":"delegation","authority_id":"authority.example.001","status":"active"},"approval":{"required":true,"status":"approved","approver":{"type":"human","id":"human.example"},"scope":"Execute task.example.001","timestamp":"2026-09-16T15:00:00Z"},"action":{"type":"execute","description":"Perform approved task","status":"completed","target":{"type":"task","id":"task.example.001"}},"timestamps":{"created_at":"2026-09-16T15:02:00Z","occurred_at":"2026-09-16T15:02:00Z","completed_at":"2026-09-16T15:02:04Z"}}