{"record_id":"gr.registration.001","record_type":"registration","schema_version":"1.0.0","actor":{"type":"registrar","id":"registry.example"},"registration":{"subject":{"type":"agent","id":"agent.example"},"registry":"governance-commons"},"timestamps":{"created_at":"2026-09-16T15:32:00Z","occurred_at":"2026-09-16T15:32:00Z"}}