{"record_id":"gr.intent.001","record_type":"intent","schema_version":"1.0.0","actor":{"type":"human","id":"human.example"},"intent":{"statement":"Evaluate the proposed task.","objective":"Determine whether work should proceed."},"timestamps":{"created_at":"2026-09-16T15:01:00Z","occurred_at":"2026-09-16T15:01:00Z"}}