{"record_id":"gr.revoked-action.example.001","record_type":"action","schema_version":"1.0.0","subject":{"type":"task","id":"task.example.003"},"actor":{"type":"agent","id":"agent.example"},"authority":{"basis":"delegation","authority_id":"authority.example.003","status":"revoked","granted_at":"2026-09-16T16:00:00Z","revoked_at":"2026-09-16T16:10:00Z"},"approval":{"required":false,"status":"approved","approver":{"type":"human","id":"human.example"},"scope":"Execute task.example.003","timestamp":"2026-09-16T16:00:00Z"},"action":{"type":"execute","status":"completed"},"timestamps":{"created_at":"2026-09-16T16:11:00Z","occurred_at":"2026-09-16T16:11:00Z","completed_at":"2026-09-16T16:11:05Z"}}