{"record_id":"gr.validation.001","record_type":"validation","schema_version":"1.0.0","actor":{"type":"validator","id":"governance-commons-validator"},"validation":{"result":"valid","specification":"governance-record"},"timestamps":{"created_at":"2026-09-16T15:22:00Z","occurred_at":"2026-09-16T15:22:00Z"}}